Formulaire;Millésime;Zone;Type;Donnée;Répétable;Table/Format;Balise XML;Intitulé;Commentaire
3310CA3G;17;GM;MOA;C516.5004.01;NON;;Valeur;Contribution à l'audiovisuel public (ex-redevance audiovisuelle) due par les loueurs d'appareils;
3310CA3G;17;GO;MOA;C516.5004.01;NON;;Valeur;Taxe sur les boues d'épuration urbaines et industrielles;
3310CA3G;17;GP;MOA;C516.5004.01;NON;;Valeur;Taxe sur les ventes et les locations de vidéogrammes destinés à l'usage privé du public / Taxe sur la diffusion en vidéo physique et en ligne de contenus audiovisuels au taux de  2%;
3310CA3G;17;GQ;MOA;C516.5004.01;NON;;Valeur;Taxe sur les ventes et les locations de vidéogrammes destinés à l'usage privé du public / Taxe sur la diffusion en vidéo physique et en ligne de contenus audiovisuels au taux de 10%;
3310CA3G;17;GR;MOA;C516.5004.01;NON;;Valeur;Taxe sur la publicité diffusée par voie de radiodiffusion sonore et de télévision;
3310CA3G;17;GS;MOA;C516.5004.01;NON;;Valeur;Taxe sur la publicité télévisée;
3310CA3G;17;GT;MOA;C516.5004.01;NON;;Valeur;Taxe sur la publicité diffusée par les chaînes de télévision;
3310CA3G;17;GU;MOA;C516.5004.01;NON;;Valeur;Taxe sur les actes des huissiers de justice;
3310CA3G;17;GV;MOA;C516.5004.01;NON;;Valeur;Taxe sur les services fournis par les opérateurs de communication électronique;
3310CA3G;17;GX;MOA;C516.5004.01;NON;;Valeur;Taxe sur l'embarquement et le débarquement de passagers en Corse;
3310CA3G;17;GZ;MOA;C516.5004.01;NON;;Valeur;Taxe pour le développement de la formation professionnelle dans les métiers de la réparation de l'automobile, du cycle et du motocycle;
3310CA3G;17;HC;MOA;C516.5004.01;NON;;Valeur;Contribution sur les activités privées de sécurité;
3310CA3G;17;HK;MOA;C516.5004.01;NON;;Valeur;Récapitulation, Total des taxes parafiscales;
3310CA3G;17;HL;MOA;C516.5004.01;NON;;Valeur;Contribution due par les gestionnaires des réseaux publics d'électricité  (art. L2224-31 I bis du code général des collectivités territoriales);
3310CA3G;17;HM;MOA;C516.5004.01;NON;;Valeur;Taxe sur les contrats d'échange sur défaut d'un Etat (CGI, art.235 ter ZD ter);
3310CA3G;17;HN;MOA;C516.5004.01;NON;;Valeur;Taxe sur les excédents de provision des entreprises d'assurances de dommages (CGI, art. 235 TER X);
3310CA3G;17;HO;MOA;C516.5004.01;NON;;Valeur;Taxe sur les ordres annulés dans le cadre d'opérations à haute fréquence (CGI, art.235 TER ZD BIS);
3310CA3G;17;HP;MOA;C516.5004.01;NON;;Valeur;Taxe de risque systémique (CGI, art. 235 TER ZE);
3310CA3G;17;HQ;MOA;C516.5004.01;NON;;Valeur;Taxe sur le résultat des entreprises ferroviaires (CGI, art. 235 TER ZF);
3310CA3G;17;HR;MOA;C516.5004.01;NON;;Valeur;Contribution de solidarité territoriale (CGI, art. 302 BIS ZC);
3310CA3G;17;HS;MOA;C516.5004.01;NON;;Valeur;Imposition forfaitaire sur les pylônes (CGI, art. 1519 A);
3310CA3G;17;HT;MOA;C516.5004.01;NON;;Valeur;Taxe sur les éoliennes maritimes (CGI, art. 1519 B);
3310CA3G;17;HU;MOA;C516.5004.01;NON;;Valeur;Prélèvement sur les films pornographiques ou d'incitation à la violence et sur les représentations théâtrales à caractère pornographique (CGI, art. 1605 sexies);
3310CA3G;17;KF;CCI;C889.7111.01;NON;TBX;Valeur;Mention déclaration néante;
3310CA3G;17;KJ;MOA;C516.5004.01;NON;;Valeur;Redevance sanitaire pour le contrôle de certaines substances et de leurs résidus (CGI, art. 302 bis WC);
3310CA3G;17;KK;MOA;C516.5004.01;NON;;Valeur;Redevance sanitaire de première mise sur le marché des produits de la pêche ou de l'aquaculture (CGI, art. 302 bis WA);
3310CA3G;17;KL;MOA;C516.5004.01;NON;;Valeur;Redevance sanitaire de transformation des produits de la pêche ou de l'aquaculture (CGI, art. 302 bis WB);
3310CA3G;17;KM;MOA;C516.5004.01;NON;;Valeur;Redevance pour agrément des établissements du secteur de l'alimentation animale (CGI, art. 302 bis WD à WG);
3310CA3G;17;KR;MOA;C516.5004.01;NON;;Valeur;Total général de la TVA brute (report de la ligne 16 des déclarations des membres);
3310CA3G;17;KS;MOA;C516.5004.01;NON;;Valeur;Redevance sanitaire d'abattage (CGI, art. 302 bis N à 302 bis R);
3310CA3G;17;KT;MOA;C516.5004.01;NON;;Valeur;Redevance sanitaire de découpage (CGI, art. 302 bis S à 302 bis W);
3310CA3G;17;KU;MOA;C516.5004.01;NON;;Valeur;Redevance phytosanitaire à la circulation intracommunautaire et à l'exportation (L 251-17-1 du code rural et de la pêche maritime) - à la circulation intracommunautaire (PPE);
3310CA3G;17;KV;MOA;C516.5004.01;NON;;Valeur;Redevance phytosanitaire à la circulation intracommunautaire et à l'exportation (L 251-17-1 du code rural et de la pêche maritime) - à l'exportation;
3310CA3G;17;KW;MOA;C516.5004.01;NON;;Valeur;Taxe forfaitaire sur les métaux précieux (CGI, art.150 VM) - au taux de 6 %;
3310CA3G;17;KX;MOA;C516.5004.01;NON;;Valeur;Taxe forfaitaire sur les métaux précieux (CGI, art.150 VM) - au taux de 10 %;
3310CA3G;17;KY;MOA;C516.5004.01;NON;;Valeur;Contribution pour le remboursement de la dette sociale (CRDS) (CGI, art. 1600-0 I) - sur les ventes de métaux précieux;
3310CA3G;17;KZ;MOA;C516.5004.01;NON;;Valeur;Contribution pour le remboursement de la dette sociale (CRDS) (CGI, art. 1600-0 I) - sur les ventes de bijoux, objets d'arts, de collection ou d'antiquité;
3310CA3G;17;LA;MOA;C516.5004.01;NON;;Valeur;Ligne 1 utilisable pour une nouvelle taxe assimilée créée en cours d'année (ligne à blanc);
3310CA3G;17;LB;MOA;C516.5004.01;NON;;Valeur;Ligne 2 utilisable pour une nouvelle taxe assimilée créée en cours d'année (ligne à blanc);
3310CA3G;17;LC;MOA;C516.5004.01;NON;;Valeur;Ligne 3 utilisable pour une nouvelle taxe assimilée créée en cours d'année (ligne à blanc);
3310CA3G;17;LD;MOA;C516.5004.01;NON;;Valeur;Ligne 4 utilisable pour une nouvelle taxe assimilée créée en cours d'année (ligne à blanc);
3310CA3G;17;LF;MOA;C516.5004.01;NON;;Valeur;Ligne 5 utilisable pour une nouvelle taxe assimilée créée en cours d'année (ligne à blanc);
3310CA3G;17;LG;MOA;C516.5004.01;NON;;Valeur;Taxe pour le financement du fonds de soutien aux collectivités territoriales ayant contracté des produits structurés (CGI, art. 235 ter ZE bis);
3310CA3G;17;MA;MOA;C516.5004.01;NON;;Valeur;Contribution forfaitaire pour alimentation du fonds commun des accidents du travail agricole (CGI, art. 1622);
3310CA3G;17;MB;MOA;C516.5004.01;NON;;Valeur;Prélèvement sur les paris hippiques - au profit de l'Etat (CGI, art. 302 bis ZG);
3310CA3G;17;MC;MOA;C516.5004.01;NON;;Valeur;Prélèvement sur les paris hippiques - au profit des organismes de sécurité sociale (CSS, art. L137-20);
3310CA3G;17;MD;MOA;C516.5004.01;NON;;Valeur;Prélèvement sur les paris hippiques - engagés depuis l'étranger des courses françaises et regroupés en France (CGI, art.302 bis ZO);
3310CA3G;17;ME;MOA;C516.5004.01;NON;;Valeur;Redevance due par les opérateurs agréés de paris hippiques en ligne - Enjeux relatifs aux courses de trot (CGI, art. 1609 tertricies);
3310CA3G;17;MF;MOA;C516.5004.01;NON;;Valeur;Redevance due par les opérateurs agréés de paris hippiques en ligne - Enjeux relatifs aux courses de galop (CGI, art. 1609 tertricies);
3310CA3G;17;MG;MOA;C516.5004.01;NON;;Valeur;Prélèvement sur les paris sportifs - au profit de l'Etat (CGI, art.302 bis ZH);
3310CA3G;17;MH;MOA;C516.5004.01;NON;;Valeur;Prélèvement sur les paris sportifs - au profit des organismes de sécurité sociale (CSS, art. L137-21);
3310CA3G;17;MJ;MOA;C516.5004.01;NON;;Valeur;Prélèvement sur les paris sportifs - au profit du centre national pour le développement du sport (CNDS) (CGI, art. 1609 tricies);
3310CA3G;17;MK;MOA;C516.5004.01;NON;;Valeur;Prélèvement sur les jeux de cercles - au profit de l'Etat (CGI, art. 302 bis ZI);
3310CA3G;17;ML;MOA;C516.5004.01;NON;;Valeur;Prélèvement sur les jeux de cercles - au profit des organismes de sécurité sociale (CSS, art. L137-22);
3310CA3G;17;MM;MOA;C516.5004.01;NON;;Valeur;Prélèvement au profit des organismes de sécurité sociale sur le produit des appels à des numéros surtaxés effectués dans le cadre des programmes télévisés et radiodiffusés comportant des jeux et des concours (CSS, art. L137-19);
3310CA3G;17;MN;MOA;C516.5004.01;NON;;Valeur;Prélèvement au profit du centre national pour le développement du sport (CNDS) sur les jeux commercialisés par la Française des jeux (CGI, art. 1609 novovicies) - au taux de 0,3 %;
3310CA3G;17;MP;MOA;C516.5004.01;NON;;Valeur;Prélèvement au profit du centre national pour le développement du sport (CNDS) sur les jeux commercialisés par la Française des jeux (CGI, art. 1609 novovicies) - au taux de 1,8 %;
3310CA3G;17;MR;MOA;C516.5004.01;NON;;Valeur;Taxe pour frais de contrôle sur les activités de transport public routier de personnes (CGI, art. 1609 sextricies);
3310CA3G;17;MS;MOA;C516.5004.01;NON;;Valeur;Taxe annuelle pour frais de contrôle due par les concessionnaires d'autoroutes (CGI, art. 1609 septtricies);
3310CA3G;17;MT;MOA;C516.5004.01;NON;;Valeur;Base imposable sur la taxe pour frais de contrôle sur les activités de transport public routier de personnes (CGI, art. 1609 sextricies);
3310CA3G;17;MU;MOA;C516.5004.01;NON;;Valeur;Base imposable sur la taxe annuelle pour frais de contrôle due par les concessionnaires d'autoroutes (CGI, art. 1609 septtricies);
3310CA3G;17;MV;MOA;C516.5004.01;NON;;Valeur;Base imposable de la taxe forfaitaire sur les métaux précieux (CGI, art.150 VM) - au taux de 6 %;
3310CA3G;17;MX;MOA;C516.5004.01;NON;;Valeur;Base imposable de la taxe forfaitaire sur les métaux précieux (CGI, art.150 VM) - au taux de 10 %;
3310CA3G;17;MY;MOA;C516.5004.01;NON;;Valeur;Base imposable de la contribution pour le remboursement de la dette sociale (CRDS) (CGI, art. 1600-0 I) - sur les ventes de métaux précieux;
3310CA3G;17;MZ;MOA;C516.5004.01;NON;;Valeur;Base imposable de la contribution pour le remboursement de la dette sociale (CRDS) (CGI, art. 1600-0 I) - sur les ventes de  bijoux, objets d'arts, de collection ou d'antiquité;
3310CA3G;17;NA;MOA;C516.5004.01;NON;;Valeur;Prélèvement progressif assis sur le produit des jeux (CGCT, art. L. 2333-57);
3310CA3G;17;NB;MOA;C516.5004.01;NON;;Valeur;Prélèvement complémentaire assis sur le produit des jeux (CGCT, art. L. 2333-57);
3310CA3G;17;NC;MOA;C516.5004.01;NON;;Valeur;Contribution sociale généralisée (CGCT, art. L. 2333-57) sur une fraction égale à 68% du produit des jeux des machines à sous au taux de 9,5%;
3310CA3G;17;ND;MOA;C516.5004.01;NON;;Valeur;Contribution sociale généralisée (CGCT, art. L. 2333-57) sur le montant des gains des machines à sous d'un montant supérieur ou égal à 1 500  réglés aux joueurs par le caissier sous forme de bons de paiement manuels au taux de 12%;
3310CA3G;17;NE;MOA;C516.5004.01;NON;;Valeur;Contribution pour le remboursement de la dette sociale portant sur le montant du produit total des jeux (article 18-III de l'ordonnance n°96-50 du 24 janvier 1996) au taux de 3%;
3310CA3G;17;NF;MOA;C516.5004.01;NON;;Valeur;Contribution sociale à la charge des fournisseurs agréés de produits du tabac (CSS, art. L. 137-27 et suivants) au taux de 5,6%;
3310CA3G;17;NG;MOA;C516.5004.01;NON;;Valeur;Taxe sur les véhicules de sociétés (CGI, art. 1010) : Véhicules de sociétés taxés selon les émissions de CO2;
3310CA3G;17;NH;MOA;C516.5004.01;NON;;Valeur;Taxe sur les véhicules de sociétés (CGI, art. 1010) : Véhicules de sociétés taxés selon la puissance fiscale;
3310TER;17;AA;FTX;C108.4440.01;NON;;TexteLibre1;Commentaires type 2, ligne 1;1ère zone de 512 c
3310TER;17;AA;FTX;C108.4440.02;NON;;TexteLibre2;Commentaires type 2, ligne 2;2ème zone de 512 c
3310TER;17;AA;FTX;C108.4440.03;NON;;TexteLibre3;Commentaires type 2, ligne 3;3ème zone de 512 c
3310TER;17;AA;FTX;C108.4440.04;NON;;TexteLibre4;Commentaires type 2, ligne 4;4ème zone de 512 c
3310TER;17;AA;FTX;C108.4440.05;NON;;TexteLibre5;Commentaires type 2, ligne 5;5ème zone de 512 c
3310TER;17;AB;PCD;C501.5482.01;NON;;Valeur;Pourcentage général de déduction de l'entreprise;Valeur entière et au plus 2 décimales
3310TER;17;AC;CCI;C889.7111.01;NON;TBX;Valeur;Mention expresse type 2;Table TBX avec X pour sélectionné, CCI/7037 = CAV/1131 = TBX
3310TER;17;BM;FTX;C108.4440.01;OUI;;TexteLibre1;Libellé du secteur distinct d'activité;Une zone de 512 c
3310TER;17;CM;PCD;C501.5482.01;OUI;;Valeur;Pourcentage de déduction propre à chaque secteur;Valeur entière et au plus 2 décimales
3310TER;17;DL;MOA;C516.5004.01;NON;;Valeur;TVA brute pour l'ensemble des secteurs;
3310TER;17;DM;MOA;C516.5004.01;OUI;;Valeur;TVA brute par secteur;
3310TER;17;EL;MOA;C516.5004.01;NON;;Valeur;TVA à reverser pour l'ensemble des secteurs;
3310TER;17;EM;MOA;C516.5004.01;OUI;;Valeur;TVA à reverser par secteur;
3310TER;17;FL;MOA;C516.5004.01;NON;;Valeur;Total TVA brute et TVA à reverser pour l'ensemble des secteurs;
3310TER;17;FM;MOA;C516.5004.01;OUI;;Valeur;Total TVA brute et TVA à reverser par secteur;
3310TER;17;GL;MOA;C516.5004.01;NON;;Valeur;Total pour l'ensemble des secteurs, de la TVA déductible sur immobilisations exclusivement affectées à un secteur déterminé;
3310TER;17;GM;MOA;C516.5004.01;OUI;;Valeur;TVA déductible sur immobilisations affectées à un secteur déterminé exclusivement;
3310TER;17;HL;MOA;C516.5004.01;NON;;Valeur;Total pour l'ensemble des secteurs, de la TVA déductible sur immobilisations non exclusivement affectées à un secteur déterminé;
3310TER;17;HM;MOA;C516.5004.01;OUI;;Valeur;TVA déductible sur immobilisations affectées à un secteur déterminé non exclusivement;
3310TER;17;JL;MOA;C516.5004.01;NON;;Valeur;Total de la TVA déductible sur immobilisations pour l'ensemble des secteurs;
3310TER;17;JM;MOA;C516.5004.01;OUI;;Valeur;Total de la TVA déductible sur immobilisations par secteur;
3310TER;17;KL;MOA;C516.5004.01;NON;;Valeur;Total de la TVA déductible sur autres biens et services concourant exclusivement à la réalisation d'opérations ouvrant droit à déduction, pour l'ensemble des secteurs;
3310TER;17;KM;MOA;C516.5004.01;OUI;;Valeur;TVA déductible sur autres biens et services concourant exclusivement à la réalisation d'opérations ouvrant droit à déduction, par secteur;
3310TER;17;LL;MOA;C516.5004.01;NON;;Valeur;Total de la TVA déductible sur autres biens et services concourant non exclusivement à la réalisation d'opérations ouvrant droit à déduction, pour l'ensemble des secteurs;
3310TER;17;LM;MOA;C516.5004.01;OUI;;Valeur;TVA déductible sur autres biens et services concourant non exclusivement à la réalisation d'opérations ouvrant droit à déduction, par secteur;
3310TER;17;ML;MOA;C516.5004.01;NON;;Valeur;Total de la TVA déductible sur autres biens et services pour l'ensemble des secteurs;
3310TER;17;MM;MOA;C516.5004.01;OUI;;Valeur;Total de la TVA déductible sur autres biens et services par secteur;
3310TER;17;NL;MOA;C516.5004.01;NON;;Valeur;Complément de TVA déductible pour l'ensemble des secteurs;
3310TER;17;NM;MOA;C516.5004.01;OUI;;Valeur;Complément de TVA déductible par secteur;
3310TER;17;PL;MOA;C516.5004.01;NON;;Valeur;Total de la TVA déductible pour l'ensemble des secteurs;
3310TER;17;PM;MOA;C516.5004.01;OUI;;Valeur;Total de la TVA déductible par secteur;
3310TER;17;QL;MOA;C516.5004.01;NON;;Valeur;Total de la TVA nette pour l'ensemble des secteurs;si col 3 = col 11, col 3 et col 11 non = 0
3310TER;17;QM;MOA;C516.5004.01;NON;;Valeur;TVA nette due de l'ensemble des secteurs;si (col.12 + col.14) - col.13 = 0, col.12, col.13, et col.14 non tous = 0
3310TER;17;QN;MOA;C516.5004.01;OUI;;Valeur;TVA nette par secteur;si col 3 = col 11, col 3 et col 11 non = 0
3310TER;17;RL;MOA;C516.5004.01;NON;;Valeur;Total crédit de TVA pour l'ensemble des secteurs;
3310TER;17;RM;MOA;C516.5004.01;NON;;Valeur;Crédit de TVA de l'ensemble des secteurs;
3310TER;17;RN;MOA;C516.5004.01;OUI;;Valeur;Crédit de TVA par secteur;
3514;17;CA;CCI;C889.7111.01;NON;TBX;Valeur;Paiement par imputation;Table TBX avec X pour sélectionné, CCI/7037 = CAV/1131 = TBX
3514;17;CB;FTX;C108.4440.01;NON;;TexteLibre1;Commentaires type 1, ligne 1;1ère zone de 512 c
3514;17;CB;FTX;C108.4440.02;NON;;TexteLibre2;Commentaires type 1, ligne 2;2ème zone de 512 c
3514;17;CB;FTX;C108.4440.03;NON;;TexteLibre3;Commentaires type 1, ligne 3;3ème zone de 512 c
3514;17;CB;FTX;C108.4440.04;NON;;TexteLibre4;Commentaires type 1, ligne 4;4ème zone de 512 c
3514;17;CB;FTX;C108.4440.05;NON;;TexteLibre5;Commentaires type 1, ligne 5;5ème zone de 512 c
3514;17;CC;CCI;C889.7111.01;NON;TBX;Valeur;Mention expresse;Table TBX avec X pour sélectionné, CCI/7037 = CAV/1131 = TBX
3514;17;DE;CCI;C889.7111.01;NON;TBX;Valeur;Je demande la suspension  du ou des acomptes restant à courir;Table TBX avec X pour sélectionné, CCI/7037 = CAV/1131 = TBX
3514;17;HA;MOA;C516.5004.01;NON;;Valeur;Montant de l'acompte attendu ou modulé;Valeur positive ou nulle ou vide
3514;17;HB;MOA;C516.5004.01;NON;;Valeur;Montant du crédit ou de l'excédent de TVA, figurant sur la précédente déclaration CA12/CA12E,  et à déduire éventuellement du montant de l'acompte attendu ou modulé;Valeur positive ou nulle ou vide
3514;17;HC;MOA;C516.5004.01;NON;;Valeur;Montant total de la TVA à payer à la place de l'acompte de TVA;
3514;17;IA;MOA;C516.5004.01;NON;;Valeur;Montant de la TVA collectée au titre du semestre;Valeur positive ou nulle ou vide
3514;17;IB;MOA;C516.5004.01;NON;;Valeur;Montant de la TVA déductible au titre du semestre;Valeur positive ou nulle ou vide
3514;17;IC;MOA;C516.5004.01;NON;;Valeur;Crédit de TVA dégagé au titre du semestre;
3514;17;ID;MOA;C516.5004.01;NON;;Valeur;Remboursement de la TVA sur investissements;Valeur positive ou nulle ou vide
3515SD;17;AA;DTM;C507.2380.01;NON;610;Valeur;Mois de régularisation;2379 = 610 (SSAAMM), Format attendu : yyyyMM
3515SD;17;AB;DTM;C507.2380.01;NON;610;Valeur;Mois de l'acompte;2379 = 610 (SSAAMM), Format attendu : yyyyMM
3515SD;17;BB;MOA;C516.5004.01;NON;;Valeur;Acompte à déduire;
3515SD;17;BC;MOA;C516.5004.01;NON;;Valeur;Complément à verser;si a = b, a et b non = 0
3515SD;17;BD;MOA;C516.5004.01;NON;;Valeur;Excédent à imputer;
3515SD;17;BE;MOA;C516.5004.01;NON;;Valeur;Total de la TVA nette due (ligne 28 déterminée sans tenir compte des lignes 5B et 2C);
3515SD;17;BF;MOA;C516.5004.01;NON;;Valeur;Total des taxes assimilées (ligne 29 de la déclaration CA3);
3515SD;17;CA;MOA;C516.5004.01;NON;;Valeur;Nouvel acompte;
3515SD;17;CB;MOA;C516.5004.01;NON;;Valeur;Somme à payer;
3515SD;17;DA;MOA;C516.5004.01;NON;;Valeur;Report de somme à payer;
3515SD;17;DB;MOA;C516.5004.01;NON;;Valeur;Report de total de l'impôt;
3515SD;17;DC;MOA;C516.5004.01;NON;;Valeur;Somme à payer dégagée positive;Montant exprimé sans signe, si f = a,  f et a non = 0
3515SD;17;DD;MOA;C516.5004.01;NON;;Valeur;Somme à payer dégagée négative;Montant exprimé sans signe
3515SD;17;EA;FTX;C108.4440.01;NON;;TexteLibre1;Commentaires type3, ligne 1;1ère zone de 512 c
3515SD;17;EA;FTX;C108.4440.02;NON;;TexteLibre2;Commentaires type 3, ligne 2;2ème zone de 512 c
3515SD;17;EA;FTX;C108.4440.03;NON;;TexteLibre3;Commentaires type 3, ligne 3;3ème zone de 512 c
3515SD;17;EA;FTX;C108.4440.04;NON;;TexteLibre4;Commentaires type 3, ligne 4;4ème zone de 512 c
3515SD;17;EA;FTX;C108.4440.05;NON;;TexteLibre5;Commentaires type 3, ligne 5;5ème zone de 512 c
3515SD;17;EB;CCI;C889.7111.01;NON;TBX;Valeur;Mention expresse type 3;Table TBX avec X pour sélectionné, CCI/7037 = CAV/1131 = TBX
3517BCA12A;17;AE;CCI;C889.7111.01;NON;CEX;Valeur;Mention CA12 / CA12E, CA12A / CA12AE;Table CEX valeur 12 pour 3517 Bis CA12A et 12E pour 3517 Bis CA12AE, CCI/7037=CAV/1131=CEX
3517BCA12A;17;AF;CCI;C889.7111.01;NON;TBX;Valeur;Paiement par imputation;Table TBX avec X pour sélectionné, CCI/7037 = CAV/1131 = TBX
3517BCA12A;17;AG;CCI;C889.7111.01;NON;TBX;Valeur;Mention expresse;Table TBX avec X pour sélectionné, CCI/7037 = CAV/1131 = TBX
3517BCA12A;17;BA;FTX;C108.4440.01;NON;;TexteLibre1;Commentaires type 1, ligne 1;1ère zone de 512 c
3517BCA12A;17;BA;FTX;C108.4440.02;NON;;TexteLibre2;Commentaires type 1, ligne 2;2ème zone de 512 c
3517BCA12A;17;BA;FTX;C108.4440.03;NON;;TexteLibre3;Commentaires type 1, ligne 3;3ème zone de 512 c
3517BCA12A;17;BA;FTX;C108.4440.04;NON;;TexteLibre4;Commentaires type 1, ligne 4;4ème zone de 512 c
3517BCA12A;17;BA;FTX;C108.4440.05;NON;;TexteLibre5;Commentaires type 1, ligne 5;5ème zone de 512 c
3517BCA12A;17;DA;MOA;C516.5004.01;NON;;Valeur;Opérations non imposables - Achats en franchise;
3517BCA12A;17;DB;MOA;C516.5004.01;NON;;Valeur;Union européenne;
3517BCA12A;17;DC;MOA;C516.5004.01;NON;;Valeur;Autres opérations non imposables;
3517BCA12A;17;DD;MOA;C516.5004.01;NON;;Valeur;Opérations non imposables, livraisons intra-communautaires;
3517BCA12A;17;DE;MOA;C516.5004.01;NON;;Valeur;Chiffre d'affaires réalisé en France métropolitaine imposable au taux réduit, hors livraisons de gaz naturel ou d'electricité et acquisitions intracommunautaires : base HT;
3517BCA12A;17;DF;MOA;C516.5004.01;NON;;Valeur;Ventes à distance taxables dans l'Etat membre d'arrivée;
3517BCA12A;17;DH;MOA;C516.5004.01;NON;;Valeur;Chiffre d'affaires imposable (France métropolitaine ou DOM), hors livraisons de gaz naturel ou d'electricité et acquisitions intracommunautaires, aux anciens taux : base HT;
3517BCA12A;17;DJ;MOA;C516.5004.01;NON;;Valeur;Opérations imposables à un taux particulier base HT;
3517BCA12A;17;DK;MOA;C516.5004.01;NON;;Valeur;Opérations imposables réalisées en France métropolitaine au taux normal de 20% : Base HT;
3517BCA12A;17;DL;MOA;C516.5004.01;NON;;Valeur;Opérations imposables cessions d'immobilisations , base hors taxe;
3517BCA12A;17;DM;MOA;C516.5004.01;NON;;Valeur;Opérations imposables - livraisons à soi-même, base hors taxe;
3517BCA12A;17;DN;MOA;C516.5004.01;NON;;Valeur;Opérations imposables - Autres opérations imposables, base hors taxe;
3517BCA12A;17;DP;MOA;C516.5004.01;NON;;Valeur;Opérations imposables - acquisitions intra-communautaires, base hors taxe;
3517BCA12A;17;DQ;MOA;C516.5004.01;NON;;Valeur;Opérations imposables réalisées en France métropolitaine au taux réduit de 10% : Base HT;
3517BCA12A;17;DR;MOA;C516.5004.01;NON;;Valeur;Achats de prestations de services intracommunautaires (art 283-2 du code général des impôts) Base hors taxe;
3517BCA12A;17;DS;MOA;C516.5004.01;NON;;Valeur;Achats de prestations de services intracommunautaires (art 283-2 du code général des impôts) , taxe due;
3517BCA12A;17;DU;MOA;C516.5004.01;NON;;Valeur;Chiffre d'affaires réalisé dans les DOM imposable au taux réduit, hors livraisons de gaz naturel ou d'electricité et acquisitions intracommunautaires : base HT;
3517BCA12A;17;DV;MOA;C516.5004.01;NON;;Valeur;Chiffre d'affaires réalisé dans les DOM imposable au taux normal, hors livraisons de gaz naturel ou d'electricité et acquisitions intracommunautaires : base HT;
3517BCA12A;17;DY;MOA;C516.5004.01;NON;;Valeur;Livraisons d'electricité , de gaz naturel, de chaleur ou de froid non imposables en France;
3517BCA12A;17;DZ;MOA;C516.5004.01;NON;;Valeur;Livraisons d'electricité, de gaz naturel, de chaleur ou de froid imposables en France, base hors taxe;
3517BCA12A;17;EA;MOA;C516.5004.01;NON;;Valeur;Ligne utilisable pour un nouveau taux en métropole (ligne à blanc);
3517BCA12A;17;EB;MOA;C516.5004.01;NON;;Valeur;Ligne utilisable pour un nouveau taux en métropole (ligne à blanc);
3517BCA12A;17;EC;MOA;C516.5004.01;NON;;Valeur;Ligne utilisable pour un nouveau taux dans les DOM (ligne à blanc);
3517BCA12A;17;ED;MOA;C516.5004.01;NON;;Valeur;Ligne utilisable pour un nouveau taux dans les DOM (ligne à blanc);
3517BCA12A;17;EE;MOA;C516.5004.01;NON;;Valeur;Chiffre d'affaires réalisé en France métropolitaine imposable au taux réduit, hors livraisons de gaz naturel ou d'electricité et acquisitions intracommunautaires : taxe due;
3517BCA12A;17;EH;MOA;C516.5004.01;NON;;Valeur;Chiffre d'affaires imposable (France métropolitaine ou DOM), hors livraisons de gaz naturel ou d'electricité et acquisitions intracommunautaires, aux anciens taux : taxe due;
3517BCA12A;17;EJ;MOA;C516.5004.01;NON;;Valeur;Opérations imposables à un taux particulier taxe due;
3517BCA12A;17;EK;MOA;C516.5004.01;NON;;Valeur;Opérations imposables réalisées en France métropolitaine au taux normal de 20% : Taxe due;
3517BCA12A;17;EL;MOA;C516.5004.01;NON;;Valeur;Opérations imposables cessions d'immobilisations, taxe due;
3517BCA12A;17;EM;MOA;C516.5004.01;NON;;Valeur;Opérations imposables - livraisons à soi-même : taxe due;
3517BCA12A;17;EN;MOA;C516.5004.01;NON;;Valeur;Opérations imposables - Autres opérations imposables : taxe due;
3517BCA12A;17;EP;MOA;C516.5004.01;NON;;Valeur;Opérations imposables - acquisitions intra-communautaires : taxe due;
3517BCA12A;17;EQ;MOA;C516.5004.01;NON;;Valeur;Opérations imposables réalisées en France métropolitaine au taux réduit de 10% : Taxe due;
3517BCA12A;17;ER;MOA;C516.5004.01;NON;;Valeur;TVA antérieurement déduite à reverser, taxe due;
3517BCA12A;17;ES;MOA;C516.5004.01;NON;;Valeur;Total général de la TVA brute due sur opérations imposables et régularisations;
3517BCA12A;17;EU;MOA;C516.5004.01;NON;;Valeur;Chiffre d'affaires réalisé dans les DOM imposable au taux réduit, hors livraisons de gaz naturel ou d'electricité et acquisitions intracommunautaires : taxe due;
3517BCA12A;17;EV;MOA;C516.5004.01;NON;;Valeur;Chiffre d'affaires réalisé dans les DOM imposable au taux normal, hors livraisons de gaz naturel ou d'electricité et acquisitions intracommunautaires : taxe due;
3517BCA12A;17;EZ;MOA;C516.5004.01;NON;;Valeur;Livraisons d'electricité, de gaz naturel de chaud ou froid   imposables en France, taxe due;
3517BCA12A;17;FA;MOA;C516.5004.01;NON;;Valeur;TVA déductible sur biens constituant des immobilisations;
3517BCA12A;17;FB;MOA;C516.5004.01;NON;;Valeur;TVA déductible sur autres biens et services (déduction sur facture);
